{"schema":"tl-gate.action-intent/1","principal":"user:owner","orchestrator":"orchestrator:generic","agent_instance":"agent:demo#1","session_ref":"s1","capability":"filesystem.write","target":"/workspace/demo.txt","arguments_digest":"1111111111111111111111111111111111111111111111111111111111111111","tool_id":"fs","tool_version":"1.0.0","tool_digest":"2222222222222222222222222222222222222222222222222222222222222222","side_effect_class":"W1","action_id":"a1","chain_id":"c1","attempt":1,"parent_digest":""}
